{
 "$schema": "https://json-schema.org/draft/2020-12/schema",
 "$id": "https://wichaa.net/schema/amulet-atlas-node.schema.json",
 "title": "World amulet node record",
 "description": "One record per node of the world's amulet practice: a kind of amulet, a tradition that carries it, a motif cut into it, a material it is made from, a practice that makes or charges or retires it, a place, a person, an organization, a word, a picture, or a long read. The tradition's own term is the identity. Every field carries provenance (record default + per-field override). Keys beginning with x_ are free extension slots and are never rejected.",
 "type": "object",
 "required": ["schema", "id", "type", "names", "region", "text", "sources", "provenance", "confidence", "updated"],
 "additionalProperties": false,
 "patternProperties": {"^x_": {}},
 "properties": {
  "schema": {"type": "integer", "const": 1},
  "id": {"type": "string", "pattern": "^[a-z0-9]+(-[a-z0-9]+)*$"},
  "type": {"type": "string", "enum": ["amulet", "tradition", "motif", "material", "practice", "place", "person", "org", "term", "art", "story"]},
  "names": {
   "type": "object",
   "required": ["name"],
   "additionalProperties": false,
   "properties": {
    "name": {"type": "string", "minLength": 1, "description": "what the tradition calls it, in English or in romanisation"},
    "native": {"type": "string", "description": "the name in its own script"},
    "script": {"type": "string", "description": "the script `native` is written in: Arabic, Devanagari, Thai, Han, Hebrew, Greek, Cyrillic, Ge'ez, Hiragana, hieroglyphic"},
    "lang": {"type": "string", "description": "BCP-47-ish language tag for `native`, e.g. ar, th, he, ja, am"},
    "said": {"type": "string", "description": "how it is said out loud where it is used"},
    "aliases": {"type": "array", "items": {"type": "string"}},
    "sort": {"type": "string"}
   }
  },
  "etymology": {
   "type": "object",
   "additionalProperties": false,
   "properties": {
    "root": {"type": "string", "description": "the etymon or morpheme chain, e.g. Latin amuletum > French amulette > English amulet"},
    "first_attested": {"type": "string", "description": "earliest dated use you can NAME with a source; blank if none"},
    "note": {"type": "string"},
    "folk": {"type": "string", "description": "a folk etymology, labelled as one"},
    "tier": {"$ref": "#/$defs/tier"},
    "source": {"type": "string"}
   }
  },
  "region": {"type": "array", "minItems": 1, "items": {"type": "string"}, "description": "open list, validated against data/vocab/regions.json with a warning"},
  "countries": {"type": "array", "items": {"type": "string", "pattern": "^[A-Z]{2}$"}, "description": "ISO 3166-1 alpha-2 codes the practice is documented in; drives the world map"},
  "facets": {
   "type": "object",
   "description": "open per-type facets; scalars or lists. Known keys per type in data/vocab/facets.json",
   "additionalProperties": {"type": ["string", "number", "boolean", "null", "array"], "items": {"type": ["string", "number"]}}
  },
  "text": {
   "type": "object",
   "required": ["what"],
   "additionalProperties": false,
   "properties": {
    "what": {"type": "string", "minLength": 1, "description": "one plain paragraph: what it is"},
    "story": {"type": "string", "description": "narrative, told as narrative; source marks inline: *Tradition holds —* / *Inference —*"},
    "how": {"type": "string", "description": "how it is made, charged, worn, kept, retired"},
    "today": {"type": "string", "description": "present-tense state, dated"},
    "notes": {"type": "string"}
   }
  },
  "kin": {
   "type": "array",
   "description": "what other nodes ARE to this one, said from here. Directional: the other record says its own sentence back.",
   "items": {
    "type": "object",
    "required": ["to", "as"],
    "additionalProperties": false,
    "properties": {
     "to": {"type": "string", "pattern": "^[a-z0-9]+(-[a-z0-9]+)*$"},
     "as": {"type": "string", "minLength": 1},
     "rel": {"type": "string", "enum": ["part", "whole", "origin", "descendant", "contrast", "parallel", "place", "person", "event", "term", "motif", "material", "practice", "tradition", "carries", "carried-by", "made-at", "held-at", "same-word", "kin", "org", "art", "story", "source"]}
    }
   }
  },
  "confusable_with": {
   "type": "array",
   "items": {"type": "object", "required": ["id", "tell"], "additionalProperties": false,
    "properties": {"id": {"type": "string"}, "tell": {"type": "string"}}}
  },
  "dating": {
   "type": "object",
   "description": "When the thing is attested. Years are astronomical integers: 1 CE is 1, 1 BCE is 0, 500 BCE is -499. Use `label` for how a reader should read it.",
   "additionalProperties": false,
   "properties": {
    "period": {"type": "string", "description": "the period name a museum label would print, e.g. Middle Kingdom, Late Roman, Edo"},
    "from_year": {"type": ["integer", "null"], "description": "earliest attested, astronomical year"},
    "to_year": {"type": ["integer", "null"], "description": "latest attested; null means still in use"},
    "living": {"type": "boolean", "description": "true where people still carry it as of the `updated` date"},
    "label": {"type": "string", "description": "the span in words, e.g. 'c. 2000 BCE to the present'"},
    "method": {"type": "string", "enum": ["excavated", "inscribed", "textual", "ethnographic", "art-historical", "dated-object", "undated"], "description": "how the date is known"},
    "circa": {"type": "boolean"},
    "tier": {"$ref": "#/$defs/tier"},
    "source": {"type": "string"},
    "note": {"type": "string"}
   }
  },
  "object": {
   "type": "object",
   "description": "The physical thing, described the way a catalogue card describes it. Any field nobody publishes stays null or absent — never estimated here.",
   "additionalProperties": false,
   "properties": {
    "form": {"type": "string", "description": "key from data/vocab/forms.json: pendant, ring, bead, plaque, scroll, packet, knot, cord, coin, figurine, tattoo, nail, mirror, bell, bag, tablet, card, sticker"},
    "materials": {"type": "array", "items": {"type": "string"}, "description": "keys from data/vocab/materials.json"},
    "worn": {"type": "array", "items": {"type": "string"}, "description": "keys from data/vocab/worn.json: neck, wrist, upper-arm, ankle, waist, hair, ear, pocket, sewn-in, door, vehicle, boat, foundation, grave, shop, field, cradle, phone"},
    "made_by": {"type": "string", "description": "who is entitled to make it, in the tradition's own terms"},
    "inscription": {"type": "string", "description": "what is written on it, in translation; put the script in `script`"},
    "script": {"type": "string"},
    "length_mm": {"type": ["number", "null"], "description": "typical longest dimension, only where a source publishes one"},
    "colour": {"type": "array", "items": {"type": "string"}},
    "count": {"type": ["integer", "null"], "description": "where the tradition specifies a number — beads, knots, folds"},
    "single_use": {"type": ["boolean", "null"], "description": "true where it is retired or burnt after a term"},
    "source": {"type": ["string", "null"], "pattern": "^s:"},
    "note": {"type": ["string", "null"]}
   }
  },
  "against": {
   "type": "array",
   "description": "What the tradition says it is for. Reported, never adjudicated. Keys from data/vocab/against.json.",
   "items": {
    "type": "object",
    "required": ["harm", "source"],
    "additionalProperties": false,
    "properties": {
     "harm": {"type": "string"},
     "who": {"type": "string", "description": "whose claim this is: the maker, a text, wearers, an ethnographer"},
     "quote": {"type": "string", "description": "the claim in somebody's own words, in quotation marks, attributed"},
     "source": {"type": "string", "pattern": "^s:"},
     "tier": {"type": "string", "enum": ["cited", "tradition", "field"]},
     "note": {"type": "string"}
    }
   }
  },
  "holdings": {
   "type": "array",
   "description": "Where examples can be seen. An accession number goes in ONLY when read off a published catalogue entry; otherwise leave it out.",
   "items": {
    "type": "object",
    "required": ["museum", "source"],
    "additionalProperties": false,
    "properties": {
     "museum": {"type": "string", "description": "key from data/vocab/museums.json"},
     "what": {"type": "string"},
     "accession": {"type": "string"},
     "url": {"type": "string", "pattern": "^https?://"},
     "source": {"type": "string", "pattern": "^s:"},
     "open_access": {"type": ["boolean", "null"], "description": "true where the museum publishes its images under an open licence"},
     "note": {"type": "string"}
    }
   }
  },
  "restricted": {
   "type": "object",
   "description": "Set where a tradition restricts what outsiders may be told or shown. The site prints the note instead of the detail, and the detail does not get written.",
   "additionalProperties": false,
   "required": ["note"],
   "properties": {
    "note": {"type": "string"},
    "who_says": {"type": "string"},
    "source": {"type": "string"},
    "url": {"type": "string", "pattern": "^https?://"}
   }
  },
  "geo": {
   "type": ["object", "null"],
   "additionalProperties": false,
   "required": ["lat", "lon"],
   "properties": {
    "lat": {"type": "number"}, "lon": {"type": "number"},
    "precision": {"type": "string", "enum": ["exact", "street", "town", "region", "country"]},
    "source": {"type": "string"}
   }
  },
  "address": {
   "type": "object",
   "additionalProperties": false,
   "properties": {
    "street": {"type": "string"}, "city": {"type": "string"}, "admin": {"type": "string"},
    "country": {"type": "string", "pattern": "^[A-Z]{2}$"}, "postcode": {"type": "string"}
   }
  },
  "links": {"type": "array", "items": {"type": "object", "required": ["label", "url"], "additionalProperties": false,
    "properties": {"label": {"type": "string"}, "url": {"type": "string", "pattern": "^https?://"}}}},
  "sources": {"type": "array", "items": {"type": "string", "pattern": "^s:"}, "description": "ids from data/sources/sources.json only"},
  "provenance": {
   "type": "object", "required": ["default"], "additionalProperties": false,
   "properties": {
    "default": {"$ref": "#/$defs/prov"},
    "fields": {"type": "object", "additionalProperties": {"$ref": "#/$defs/prov"},
     "description": "dotted field path -> provenance override, e.g. text.story"}
   }
  },
  "images": {
   "type": "array",
   "items": {
    "type": "object", "required": ["file", "source", "license"], "additionalProperties": false,
    "properties": {
     "file": {"type": "string"},
     "source": {"type": "string", "enum": ["commons", "own", "contributed", "flickr", "museum", "loc", "diagram", "other"]},
     "title": {"type": "string"}, "url": {"type": "string"}, "page_url": {"type": "string"},
     "license": {"type": "string"}, "license_url": {"type": "string"},
     "author": {"type": "string"}, "credit": {"type": "string"}, "alt": {"type": "string"},
     "date": {"type": "string"}, "primary": {"type": "boolean"}, "sha256": {"type": "string"},
     "width": {"type": "integer"}, "height": {"type": "integer"}
    }
   }
  },
  "confidence": {"type": "string", "enum": ["high", "medium", "low"]},
  "needs_verification": {"type": "boolean"},
  "updated": {"type": "string", "pattern": "^\\d{4}-\\d{2}-\\d{2}$"},
  "tags": {
   "type": "array",
   "description": "Claims about a place a reader might pick it by. Every tag names its evidence.",
   "items": {
    "type": "object", "required": ["tag", "source"], "additionalProperties": false,
    "properties": {
     "tag": {"type": "string"}, "source": {"type": "string", "pattern": "^s:"},
     "tier": {"type": "string", "enum": ["cited", "harvested", "field"]},
     "note": {"type": "string"}, "since": {"type": "string"},
     "url": {"type": "string", "pattern": "^https?://"}
    }
   }
  },
  "recognitions": {
   "type": "array",
   "description": "Named recognitions by others. Counted, never weighted by this project.",
   "items": {
    "type": "object", "required": ["by", "what", "source"], "additionalProperties": false,
    "properties": {
     "by": {"type": "string"}, "what": {"type": "string"},
     "year": {"type": ["integer", "string", "null"]},
     "source": {"type": "string", "pattern": "^s:"},
     "url": {"type": "string", "pattern": "^https?://"}, "note": {"type": "string"}
    }
   }
  },
  "sections": {
   "type": "array",
   "description": "Long-form pieces (type story, art): headed sections rendered in order after text.what",
   "items": {
    "type": "object", "required": ["h", "text"], "additionalProperties": false,
    "properties": {"h": {"type": "string"}, "text": {"type": "string"},
     "images": {"type": "array", "items": {"type": "integer"}}}
   }
  },
  "quiz": {"type": "object", "description": "free-form; used by the charm-picker", "additionalProperties": true},
  "hours": {
   "type": "object",
   "description": "When a place is open, as days. A day in `open` is open; a day in `closed` is closed; a day in NEITHER is not known, which is never the same thing as closed.",
   "additionalProperties": false, "required": ["source"],
   "properties": {
    "open": {"type": "array", "items": {"type": "string", "enum": ["Mo","Tu","We","Th","Fr","Sa","Su"]}},
    "closed": {"type": "array", "items": {"type": "string", "enum": ["Mo","Tu","We","Th","Fr","Sa","Su"]}},
    "text": {"type": "string"}, "seasonal": {"type": "string"},
    "source": {"type": "string", "pattern": "^s:"},
    "url": {"type": "string", "pattern": "^https?://"},
    "tier": {"type": "string", "enum": ["cited", "harvested", "field"]},
    "checked": {"type": "string", "pattern": "^\\d{4}-\\d{2}-\\d{2}$"},
    "note": {"type": "string"}
   }
  }
 },
 "$defs": {
  "tier": {"type": "string", "enum": ["cited", "harvested", "tradition", "inference", "field"]},
  "prov": {
   "type": "object", "required": ["tier"], "additionalProperties": false,
   "properties": {"tier": {"$ref": "#/$defs/tier"}, "source": {"type": "string"},
    "note": {"type": "string"}, "fetched_at": {"type": "string"}}
  }
 }
}
