{
 "schema": 1,
 "id": "periapt",
 "type": "term",
 "names": {
  "name": "periapt",
  "native": "περίαπτον",
  "script": "Greek",
  "lang": "grc",
  "said": "PERR-ee-apt",
  "aliases": [
   "periapta",
   "periapte",
   "períapton"
  ]
 },
 "etymology": {
  "root": "Greek peri- 'around' + haptos (ἅπτος) 'fastened' > períaptos 'hung round' > períapton (περίαπτον) 'amulet' > Middle French periapte > English periapt",
  "first_attested": "Wiktionary marks the English noun from the 16th century; the earliest dated quotation on that page is Walter Scott, The Talisman, 1825",
  "note": "The gap between the marked century and the earliest quotation this project read is real and is left open here rather than closed with a guess.",
  "tier": "cited",
  "source": "s:web-wiktionary-periapt"
 },
 "region": [
  "greece-aegean",
  "britain-ireland",
  "western-europe"
 ],
 "countries": [
  "GB",
  "GR"
 ],
 "facets": {
  "language": [
   "English",
   "Greek"
  ]
 },
 "text": {
  "what": "An English word for an amulet worn hung round the neck, defined by the hanging rather than by the shape or the material. It is close to dead. It survives in antiquarian writing, in medical history, and in translations out of Greek, where the plural periapta sits in the ancient list of protective objects.",
  "story": "The Greek says what it is: períaptos, hung round. Not carved, not blessed, not written — fastened on. Ancient Greek sources list periapta among apotropaia, probaskania, periammata, phylaktiria and the rest, none of them the single dominant term.\n\nThe English quotations Wiktionary carries are all of a type. Walter Scott, in The Talisman in 1825, writes that the Persians were perhaps most remarkable for their unshaken credulity in amulets, spells, periapts and similar charms. Thomas Oswald Cockayne, in Leechdoms, Wortcunning, and Starcraft in 1864, records that the occipital bone of an ass's head in a skin is also a good periapt. Charles William King's The Natural History of Precious Stones of 1867 distinguishes a decoration from a periapt, for it was suspended round his neck by golden chains. Fielding H. Garrison's An Introduction to the History of Medicine of 1921 has a formula that became a charm for intractable haemorrhage, written on the part affected or worn as a periapt.\n\n*Inference —* the word survived exactly where the Greek did — in the Victorian antiquarian's English, and in the vocabulary of men writing about other people's practices at a distance. It never made it onto a shop sign.\n\n*Tradition holds —* the distinction the word preserves is worth keeping even if the word is not: an object that hangs is a different object from one sewn in, buried under a threshold or nailed to a door, and every one of those is in this atlas."
 },
 "dating": {
  "from_year": 1500,
  "to_year": null,
  "living": true,
  "label": "in English from the 1500s, by Wiktionary's marking",
  "method": "textual",
  "circa": true,
  "tier": "cited",
  "source": "s:web-wiktionary-periapt",
  "note": "The century is Wiktionary's marking; the earliest quotation this project read is 1825."
 },
 "kin": [
  {
   "to": "amulet-word",
   "as": "the word that beat it — both mean a worn protective object, and only one is still sold in bookshops",
   "rel": "same-word"
  },
  {
   "to": "apotropaic-word",
   "as": "the other Greek survivor in English, and the one the academy kept instead of this",
   "rel": "same-word"
  },
  {
   "to": "phylactery-word",
   "as": "its neighbour in the ancient Greek list, phylaktiria beside periapta, and the one the New Testament made permanent",
   "rel": "contrast"
  },
  {
   "to": "magical-gem",
   "as": "the class of object Victorian writers were usually describing when they reached for this word",
   "rel": "term"
  },
  {
   "to": "frederick-elworthy",
   "as": "the Victorian cataloguer whose generation kept the word in print",
   "rel": "person"
  },
  {
   "to": "wearing-hidden",
   "as": "the practice this word rules out — a periapt hangs where it can be seen",
   "rel": "contrast"
  }
 ],
 "links": [
  {
   "label": "periapt — Wiktionary",
   "url": "https://en.wiktionary.org/wiki/periapt"
  }
 ],
 "sources": [
  "s:web-wiktionary-periapt",
  "s:wp-apotropaic-magic",
  "s:wp-amulet"
 ],
 "provenance": {
  "default": {
   "tier": "cited",
   "source": "s:web-wiktionary-periapt"
  }
 },
 "images": [],
 "confidence": "medium",
 "needs_verification": true,
 "updated": "2026-09-16"
}
